### ISSUE TITLE
WalnutPi 1B does not appear on the device map after successful registration / WalnutPi 1B 成功注册后未出现在设备地图上

### ISSUE THREAD

**Issue by jdsr0989** [walnutpi/walnutpi-build#15]
The device does not appear on map.walnutpi.com 

```
root@WalnutPi:~# systemctl status map_device
● map_device.service - map device
     Loaded: loaded (/lib/systemd/system/map_device.service; enabled; preset: e>
     Active: activating (start) since Wed 2026-09-09 17:28:59 CST; 23min ago
   Main PID: 1157 (map_device)
      Tasks: 4 (limit: 2226)
     Memory: 29.1M
        CPU: 788ms
     CGroup: /system.slice/map_device.service
             ├─1157 /usr/lib/walnutpi/service/map_device
             └─1180 /usr/lib/walnutpi/service/map_device

Sep 09 17:28:59 WalnutPi systemd[1]: Starting map_device.service - map device...
```

```
root@WalnutPi:~# /usr/lib/walnutpi/service/map_device
核桃派1代
Sent: {"chip_platform": "H618", "chip_id": "33802000ac00480801081365308f24d2", "os_version": "2.6.0", "os_type": "server"}

```

The script reports that the device information was sent successfully.

The device has Internet connectivity and can resolve the map server domain correctly:

```
root@WalnutPi:~# getent hosts map.walnutpi.com
106.52.98.85    map.walnutpi.com
```

tcpdump confirms communication between the client and server.

```
18:08:15.189967 IP 192.168.0.24.33380 > 106.52.98.85.10240: Flags [S], seq 2399582240, win 64240, options [mss 1460,sackOK,TS val 3857131722 ecr 0,nop,wscale 7], length 0
	0x0000:  4500 003c e8cb 4000 4006 c4a6 c0a8 0018  E..<..@.@.......
	0x0010:  6a34 6255 8264 2800 8f06 b820 0000 0000  j4bU.d(.........
	0x0020:  a002 faf0 8d78 0000 0204 05b4 0402 080a  .....x..........
	0x0030:  e5e7 28ca 0000 0000 0103 0307            ..(.........
18:08:15.422450 IP 106.52.98.85.10240 > 192.168.0.24.33380: Flags [S.], seq 2966755180, ack 2399582241, win 65160, options [mss 1424,sackOK,TS val 1694501674 ecr 3857131722,nop,wscale 7], length 0
	0x0000:  4528 003c 0000 4000 1f06 ce4a 6a34 6255  E(.<..@....Jj4bU
	0x0010:  c0a8 0018 2800 8264 b0d5 176c 8f06 b821  ....(..d...l...!
	0x0020:  a012 fe88 8396 0000 0204 0590 0402 080a  ................
	0x0030:  6500 0b2a e5e7 28ca 0103 0307            e..*..(.....
18:08:15.422541 IP 192.168.0.24.33380 > 106.52.98.85.10240: Flags [.], ack 1, win 502, options [nop,nop,TS val 3857131955 ecr 1694501674], length 0
	0x0000:  4500 0034 e8cc 4000 4006 c4ad c0a8 0018  E..4..@.@.......
	0x0010:  6a34 6255 8264 2800 8f06 b821 b0d5 176d  j4bU.d(....!...m
	0x0020:  8010 01f6 8d70 0000 0101 080a e5e7 29b3  .....p........).
	0x0030:  6500 0b2a                                e..*
18:08:15.422676 IP 192.168.0.24.33380 > 106.52.98.85.10240: Flags [P.], seq 1:117, ack 1, win 502, options [nop,nop,TS val 3857131955 ecr 1694501674], length 116
	0x0000:  4500 00a8 e8cd 4000 4006 c438 c0a8 0018  E.....@.@..8....
	0x0010:  6a34 6255 8264 2800 8f06 b821 b0d5 176d  j4bU.d(....!...m
	0x0020:  8018 01f6 8de4 0000 0101 080a e5e7 29b3  ..............).
	0x0030:  6500 0b2a 7b22 6368 6970 5f70 6c61 7466  e..*{"chip_platf
	0x0040:  6f72 6d22 3a20 2248 3631 3822 2c20 2263  orm":."H618",."c
	0x0050:  6869 705f 6964 223a 2022 3333 3830 3230  hip_id":."338020
	0x0060:  3030 6163 3030 3438 3038 3031 3038 3133  00ac004808010813
	0x0070:  3635 3330 3866 3234 6432 222c 2022 6f73  65308f24d2",."os
	0x0080:  5f76 6572 7369 6f6e 223a 2022 322e 362e  _version":."2.6.
	0x0090:  3022 2c20 226f 735f 7479 7065 223a 2022  0",."os_type":."
	0x00a0:  7365 7276 6572 227d                      server"}
18:08:15.422875 IP 192.168.0.24.33380 > 106.52.98.85.10240: Flags [F.], seq 117, ack 1, win 502, options [nop,nop,TS val 3857131955 ecr 1694501674], length 0
	0x0000:  4500 0034 e8ce 4000 4006 c4ab c0a8 0018  E..4..@.@.......
	0x0010:  6a34 6255 8264 2800 8f06 b895 b0d5 176d  j4bU.d(........m
	0x0020:  8011 01f6 8d70 0000 0101 080a e5e7 29b3  .....p........).
	0x0030:  6500 0b2a                                e..*
18:08:15.651445 IP 106.52.98.85.10240 > 192.168.0.24.33380: Flags [.], ack 117, win 509, options [nop,nop,TS val 1694501908 ecr 3857131955], length 0
	0x0000:  4528 0034 b841 4000 1f06 1611 6a34 6255  E(.4.A@.....j4bU
	0x0010:  c0a8 0018 2800 8264 b0d5 176d 8f06 b895  ....(..d...m....
	0x0020:  8010 01fd ac83 0000 0101 080a 6500 0c14  ............e...
	0x0030:  e5e7 29b3                                ..).
18:08:15.699267 IP 106.52.98.85.10240 > 192.168.0.24.33380: Flags [.], ack 118, win 509, options [nop,nop,TS val 1694501957 ecr 3857131955], length 0
	0x0000:  4528 0034 b842 4000 1f06 1610 6a34 6255  E(.4.B@.....j4bU
	0x0010:  c0a8 0018 2800 8264 b0d5 176d 8f06 b896  ....(..d...m....
	0x0020:  8010 01fd ac51 0000 0101 080a 6500 0c45  .....Q......e..E
	0x0030:  e5e7 29b3                                ..).
18:08:16.737337 IP 106.52.98.85.10240 > 192.168.0.24.33380: Flags [F.], seq 1, ack 118, win 509, options [nop,nop,TS val 1694502904 ecr 3857131955], length 0
	0x0000:  4528 0034 b843 4000 1f06 160f 6a34 6255  E(.4.C@.....j4bU
	0x0010:  c0a8 0018 2800 8264 b0d5 176d 8f06 b896  ....(..d...m....
	0x0020:  8011 01fd a89d 0000 0101 080a 6500 0ff8  ............e...
	0x0030:  e5e7 29b3                                ..).
18:08:16.737391 IP 192.168.0.24.33380 > 106.52.98.85.10240: Flags [.], ack 2, win 502, options [nop,nop,TS val 3857133270 ecr 1694502904], length 0
	0x0000:  4500 0034 0000 4000 4006 ad7a c0a8 0018  E..4..@.@..z....
	0x0010:  6a34 6255 8264 2800 8f06 b896 b0d5 176e  j4bU.d(........n
	0x0020:  8010 01f6 a381 0000 0101 080a e5e7 2ed6  ................
	0x0030:  6500 0ff8                                e...
```

However, the device still does not appear on the map.

**Expected behavior**

After successfully running /usr/lib/walnutpi/service/map_device, the WalnutPi should be registered and become visible on the device map.

**Actual behavior**

The registration script appears to send the device information successfully, but the device never appears on the map.

**Troubleshooting performed**

    Confirmed that the WalnutPi has Internet access.
    Confirmed that map.walnutpi.com resolves successfully.
    Manually executed the registration script.
    Confirmed that the script reports the device information as sent successfully.
    Verified that the reported chip ID matches the system information.
    Tested on severals networks.

**System information**

```
/sys/class/sunxi_info/sys_info

sunxi_platform : sun50i-h616
sunxi_chipid   : 33802000ac00480801081365308f24d2
sunxi_serial   : 308f24d2010813650000ac0000000000

/etc/WalnutPi-release

version=2.6.0
date=2026-05-20 11:38
os_type=server

kernel_git=https://github.com/walnutpi/linux.git
kernel_branch=6.1.31
kernel_config=walnutpi1b_defconfig
toolchain=gcc-aarch64-linux-gnu
lcd=hdmi

root@WalnutPi:~# cat /etc/issue
Debian GNU/Linux 12 \n \l


```

**Comment by jdsr0989** [comment]
Hi Walnut Pi team! 

First of all, thanks for making such a cool feature — the **Device Map** is honestly one of the reasons I bought two Walnut Pi boards (1B and 2B). I love seeing my board on the world map. 

However, I noticed something odd:

###  The issue

Boards connecting from **Mexico** are being counted in the **USA** zone on the map, not in Mexico.

I confirmed this with two experiments:

1. **VPN test** — I routed the `map_device` telemetry through a VPN endpoint in **New Zealand**. A few minutes later, the **New Zealand counter went from 1 to 2**. So the client works fine and the map follows the public IP.
2. **Reverse test** — Checking the map metrics :
   - **Board OFF** → `USA=3`
   - **Board ON (Mexico)** → `USA=4` 
   - **Board OFF** → `USA=3` 

Could you please:

1. **Check the geolocation database** used by `api.walnutpi.com` 
2. **Verify that Mexican IPs resolve to Mexico** instead of the USA.


I'm happy to help test or provide more packet captures / logs if useful. Just let me know. 🙂

Thanks again for the great boards!
